{"collected_at":"2040-01-15T00:00:00Z","origin_group":"fictional_origin_a","records":{"byte_count":80,"path":"records.jsonl","record_count":2,"sha256":"65eb456a26c451f14d2e90b171f5c7665791dadb15f4d92eb21fe086b8c39715"},"role":"candidate","schema_version":"sourcequorum.source.v1","source_id":"demo_candidate"}
